{
  "key": "u:7d1c2f4e-3b8a-4c55-9e21-6a0f3b2d9c10|m:c3b1e0c2-8a4e-4f64-9a51-2b9f5c7e0a11|l:5e2a9d71-0c4b-4f8e-b3a6-1d7c8e9f0a22|q:500|s:0",
  "unit": {
    "id": "7d1c2f4e-3b8a-4c55-9e21-6a0f3b2d9c10",
    "name": "Staffel Nord"
  },
  "material": {
    "bt": "c3b1e0c2-8a4e-4f64-9a51-2b9f5c7e0a11",
    "name": "Laranite"
  },
  "materialKind": {
    "type": "RAW",
    "commodity": true
  },
  "location": {
    "name": "Area18",
    "uex": {
      "kind": "CITY",
      "id": 4
    }
  },
  "quality": 500,
  "stolen": false,
  "quantity": {
    "amount": 48.25,
    "unit": "SCU"
  },
  "earmarked": {
    "jobOrders": {
      "amount": 12,
      "unit": "SCU"
    },
    "missions": {
      "amount": 4,
      "unit": "SCU"
    }
  },
  "entries": [
    {
      "id": "9a7c2e10-4f3b-4d21-8c6e-2b1a0f9d8e31",
      "version": 3,
      "holder": {
        "withheld": false,
        "name": "Hauler One",
        "ref": "q0Fh3kB9xV7m2LwP5nR8tY1cZ4dE6gJ0sU3aH7bK9fM"
      },
      "quantity": {
        "amount": 30,
        "unit": "SCU"
      },
      "note": "Hangar 3, Kiste links",
      "jobOrders": [
        {
          "id": "4b2d6f80-1a3c-4e57-9b0d-7c5e3a1f2d42",
          "number": 412,
          "quantity": {
            "amount": 12,
            "unit": "SCU"
          },
          "delivered": false
        }
      ],
      "missions": [
        {
          "id": "6e8a0c24-5b7d-4f91-a3c6-8d2f4b6e0a53",
          "name": "Op Nordlicht",
          "quantity": {
            "amount": 4,
            "unit": "SCU"
          }
        }
      ],
      "free": {
        "jobOrders": {
          "amount": 18,
          "unit": "SCU"
        },
        "missions": {
          "amount": 26,
          "unit": "SCU"
        }
      }
    },
    {
      "id": "1f3e5a7c-9b2d-4c64-8e0a-3d5f7b9c1e75",
      "version": 0,
      "holder": {
        "withheld": true
      },
      "quantity": {
        "amount": 18.25,
        "unit": "SCU"
      },
      "jobOrders": [],
      "missions": [],
      "free": {
        "jobOrders": {
          "amount": 18.25,
          "unit": "SCU"
        },
        "missions": {
          "amount": 18.25,
          "unit": "SCU"
        }
      }
    }
  ]
}
